{"ambiguous":[],"audited_at":"2026-10-05T13:12:50.000Z","execution_manifest_sha256":"2984caaa5b239ade122795836daf9a192274668b9ae3ccaeba026eee004ec052","leak_audit_status":"clean","leaks":[],"passes":[{"completed_at":"2026-10-05T13:10:40.000Z","started_at":"2026-10-05T13:10:30.000Z","surfaces":[{"observed":[],"query_ok":true,"surface":"tag_index"},{"observed":[],"query_ok":true,"surface":"functions"}]},{"completed_at":"2026-10-05T13:12:50.000Z","started_at":"2026-10-05T13:12:40.000Z","surfaces":[{"observed":[],"query_ok":true,"surface":"tag_index"},{"observed":[],"query_ok":true,"surface":"functions"}]}],"record_type":"leak_audit_result","run_id":"b42ee7a8-4b45-43d7-8ca3-cb72ceae84c4","schema_version":1,"stable_absence_interval_ms":120000}
