{"ambiguous":[],"audited_at":"2026-10-07T06:29:17.518Z","execution_manifest_sha256":"3d26529048074578c43c303781c3ff54d17c0f4f22f6916fa1348955b66f202e","leak_audit_status":"clean","leaks":[],"passes":[{"completed_at":"2026-10-07T06:27:07.072Z","started_at":"2026-10-07T06:26:58.115Z","surfaces":[{"observed":[],"query_ok":true,"surface":"tag_index"},{"observed":[],"query_ok":true,"surface":"stack"},{"observed":[],"query_ok":true,"surface":"stack_resources"},{"observed":[],"query_ok":true,"surface":"functions"},{"observed":[],"query_ok":true,"surface":"event_source_mappings"},{"observed":[],"query_ok":true,"surface":"durable_executions"},{"observed":[],"query_ok":true,"surface":"queues"},{"observed":[],"query_ok":true,"surface":"tables"},{"observed":[],"query_ok":true,"surface":"log_groups"},{"observed":[],"query_ok":true,"surface":"roles"}]},{"completed_at":"2026-10-07T06:29:17.518Z","started_at":"2026-10-07T06:29:07.073Z","surfaces":[{"observed":[],"query_ok":true,"surface":"tag_index"},{"observed":[],"query_ok":true,"surface":"stack"},{"observed":[],"query_ok":true,"surface":"stack_resources"},{"observed":[],"query_ok":true,"surface":"functions"},{"observed":[],"query_ok":true,"surface":"event_source_mappings"},{"observed":[],"query_ok":true,"surface":"durable_executions"},{"observed":[],"query_ok":true,"surface":"queues"},{"observed":[],"query_ok":true,"surface":"tables"},{"observed":[],"query_ok":true,"surface":"log_groups"},{"observed":[],"query_ok":true,"surface":"roles"}]}],"record_type":"leak_audit_result","run_id":"abf41ffd-3008-4b29-81ee-b65d8095188b","schema_version":1,"stable_absence_interval_ms":120001}
